{
  "schema_version": "1.0", "scenario_id": "GS-008", "event_id": "EVT-GS-008",
  "equipment": {"equipment_id": "CNC-S04-L04-02", "display_name": "4구역 · 4셀 · CNC 가공기 2", "asset_type": "cnc", "site_id": "S04", "cell_id": "S04-L04", "line": "S04-L04", "criticality": "high", "assigned_engineer": "박지민", "last_maintenance_date": "2026-06-28", "estimated_downtime_minutes": 120, "spare_part_available": true},
  "observation": {"timestamp": "2026-08-01T00:00:00+09:00", "product_type": "M", "air_temperature_k": 299.0, "process_temperature_k": 309.5, "rotational_speed_rpm": 1450, "torque_nm": 55.0, "tool_wear_min": 230},
  "history": [
    {"timestamp": "2026-07-31T23:45:00+09:00", "product_type": "M", "air_temperature_k": 298.9, "process_temperature_k": 309.3, "rotational_speed_rpm": 1470, "torque_nm": 50.0, "tool_wear_min": 205},
    {"timestamp": "2026-07-31T23:50:00+09:00", "product_type": "M", "air_temperature_k": 299.0, "process_temperature_k": 309.4, "rotational_speed_rpm": 1462, "torque_nm": 52.0, "tool_wear_min": 214},
    {"timestamp": "2026-07-31T23:55:00+09:00", "product_type": "M", "air_temperature_k": 299.0, "process_temperature_k": 309.5, "rotational_speed_rpm": 1455, "torque_nm": 54.0, "tool_wear_min": 222},
    {"timestamp": "2026-08-01T00:00:00+09:00", "product_type": "M", "air_temperature_k": 299.0, "process_temperature_k": 309.5, "rotational_speed_rpm": 1450, "torque_nm": 55.0, "tool_wear_min": 230}
  ],
  "runtime": {"llm_available": false, "planner_available": false, "context_provider": "fixture"},
  "operation_context": {
    "load_level": "high",
    "runtime_hours_7d": 116.0,
    "production_impact": "medium",
    "context_id": "OPCTX-GS-008-2026-08-01",
    "source_type": "capacity_model",
    "temporal_scope": {"snapshot_id": "production-plan-2026-08-01", "timezone": "Asia/Seoul", "valid_from": "2026-08-01T00:00:00+09:00", "valid_to": "2026-08-02T00:00:00+09:00", "generated_at": "2026-08-01T00:00:00+09:00"},
    "production_plan": {"plan_id": "PLAN-2026-08-01-CNC", "plan_date": "2026-08-01", "planned_units": 16200, "product_mix": [{"variant": "M", "share": 0.45, "planned_units": 7290}, {"variant": "L", "share": 0.35, "planned_units": 5670}, {"variant": "H", "share": 0.2, "planned_units": 3240}]},
    "capacity_model": {"active_asset_count": 80, "planned_operating_hours": 16, "oee": 0.846, "standard_cycle_minutes_per_unit": 4.0, "asset_units_per_hour": 12.69, "daily_capacity_units": 16200, "basis": "80대 계획 설비, 16시간 계획, 표준 사이클 4.0분 기준의 계획 영향 추정"},
    "event_impact": {"event_id": "EVT-GS-008", "equipment_id": "CNC-S04-L04-02", "line": "S04-L04", "product_variant": "M", "screen_priority": "shift_inspection", "impact_status": "estimated", "estimated_lost_units": 25, "basis": {"estimated_downtime_minutes": 120, "asset_units_per_hour": 12.69, "formula": "planner unavailable fixture: 25 units"}},
    "limitations": ["LLM/Planner 비가용 상태에서도 계획 영향 참고값만 제공합니다.", "실제 MES 실적은 포함하지 않습니다.", "납기 영향은 확정하지 않습니다."]
  },
  "expected": {"risk_band": "warning", "recommended_decision": "request_inspection", "confidence": "high", "predicted_failure_type": "tool_wear_failure"}
}
