{
  "schema_version": "1.0",
  "project_id": "metropt-compressor-project",
  "dataset_version": "metropt-showcase-v1",
  "scenario_id": "MPT-001",
  "event_id": "EVT-MPT-001",
  "equipment": {
    "equipment_id": "METROPT-AIR-UNIT",
    "display_name": "MetroPT Air Production Unit",
    "line": "Compressor Station · Unit 1",
    "criticality": "high",
    "assigned_engineer": "Compressor Reliability Team",
    "last_maintenance_date": "2026-07-12",
    "estimated_downtime_minutes": 240,
    "spare_part_available": true
  },
  "observation": {
    "timestamp": "2026-08-01T00:03:00+00:00",
    "product_type": "compressor",
    "air_temperature_k": 300.0,
    "process_temperature_k": 306.8,
    "rotational_speed_rpm": 1180,
    "torque_nm": 48.0,
    "tool_wear_min": 142
  },
  "history": [
    {"timestamp": "2026-08-01T00:00:00+00:00", "product_type": "compressor", "air_temperature_k": 299.5, "process_temperature_k": 308.5, "rotational_speed_rpm": 1420, "torque_nm": 40.0, "tool_wear_min": 139},
    {"timestamp": "2026-08-01T00:01:00+00:00", "product_type": "compressor", "air_temperature_k": 299.7, "process_temperature_k": 307.9, "rotational_speed_rpm": 1360, "torque_nm": 42.0, "tool_wear_min": 140},
    {"timestamp": "2026-08-01T00:02:00+00:00", "product_type": "compressor", "air_temperature_k": 299.8, "process_temperature_k": 307.3, "rotational_speed_rpm": 1280, "torque_nm": 45.0, "tool_wear_min": 141},
    {"timestamp": "2026-08-01T00:03:00+00:00", "product_type": "compressor", "air_temperature_k": 300.0, "process_temperature_k": 306.8, "rotational_speed_rpm": 1180, "torque_nm": 48.0, "tool_wear_min": 142}
  ],
  "runtime": {"llm_available": true, "planner_available": true, "context_provider": "fixture"},
  "expected": {"risk_band": "warning", "recommended_decision": "request_inspection", "confidence": "high", "predicted_failure_type": "heat_dissipation_failure"}
}
